{
  "candidate_registry_schema_version": "2.0",
  "candidate_registry_version": "p2-v1",
  "feature_order_sha256": "aeccbe517da452e1132f08c02599418523fb003280b11ff9cda66cfb3aa55a85",
  "target": "target_cases_next_2w",
  "horizon_weeks": 2,
  "output_domain_policy": "preserve_raw_and_publish_maximum_of_zero_and_raw_prediction",
  "candidates": [
    {"model_id":"moving_average_4w","candidate_class":"comparison_baseline","selection_role":"baseline_only","model_family":"MovingAverage4W","estimator_library":"dengueops","estimator_library_version":"checkpoint-dd2fc901c1c0467481c4dfa8e284f6ef2d8e3979","parameters":{"prediction_source":"cases_rolling_4w","window_weeks":4},"parameters_sha256":"c1eff3c6bc5cf02b7176abcbf33348f0d3962791d002686d53e6654cae04a18c","preprocessing":{"type":"none","fit_scope":"not_applicable"},"preprocessing_identity":"47cee049c760f3f036cd525133ab0fe0f849ade9e41033cf437f470d9b843796","deterministic_controls":{"runtime_hyperparameter_search":false,"browser_parameters_allowed":false,"random_seed":null},"minimum_training_rows":4,"target":"target_cases_next_2w","horizon_weeks":2,"feature_order_sha256":"aeccbe517da452e1132f08c02599418523fb003280b11ff9cda66cfb3aa55a85","output_domain_rule":"nonnegative_source_expected_fail_if_invalid","failure_policy":"failed_fold_excludes_candidate_without_changing_common_plan","uncertainty_capability":"point_forecast_only","selectable":false,"selection_complexity_rank":1,"limitations":["Short-term smoothing comparison baseline only."]},
    {"model_id":"seasonal_naive_52w","candidate_class":"comparison_baseline","selection_role":"baseline_only","model_family":"SeasonalNaive52W","estimator_library":"dengueops","estimator_library_version":"checkpoint-dd2fc901c1c0467481c4dfa8e284f6ef2d8e3979","parameters":{"seasonal_lag_weeks":52,"prediction_source":"observed_cases_at_target_minus_52_weeks"},"parameters_sha256":"2395c31b374ed6b361163411122c1c0c62d2db1e16496010f3919cdd5928e80b","preprocessing":{"type":"none","fit_scope":"not_applicable"},"preprocessing_identity":"47cee049c760f3f036cd525133ab0fe0f849ade9e41033cf437f470d9b843796","deterministic_controls":{"runtime_hyperparameter_search":false,"browser_parameters_allowed":false,"random_seed":null},"minimum_training_rows":52,"target":"target_cases_next_2w","horizon_weeks":2,"feature_order_sha256":"aeccbe517da452e1132f08c02599418523fb003280b11ff9cda66cfb3aa55a85","output_domain_rule":"nonnegative_source_expected_fail_if_invalid","failure_policy":"failed_fold_excludes_candidate_without_changing_common_plan","uncertainty_capability":"point_forecast_only","selectable":false,"selection_complexity_rank":2,"limitations":["Seasonal comparison baseline only."]},
    {"model_id":"ridge_regression","candidate_class":"learned_model","selection_role":"learned_selectable","model_family":"Ridge","estimator_library":"scikit-learn","estimator_library_version":"1.9.0","parameters":{"alpha":1.0,"fit_intercept":true,"solver":"auto"},"parameters_sha256":"f59e0d298750b54d9ab8312c6a68a4eaf4910bea81042dd3a1c4711dcb307e5b","preprocessing":{"type":"StandardScaler","fit_scope":"fold_training_rows_only"},"preprocessing_identity":"9a666eb944a664443f4141b148eefb109cf3894674076df8f163d0d835474645","deterministic_controls":{"runtime_hyperparameter_search":false,"browser_parameters_allowed":false,"random_seed":null},"minimum_training_rows":19,"target":"target_cases_next_2w","horizon_weeks":2,"feature_order_sha256":"aeccbe517da452e1132f08c02599418523fb003280b11ff9cda66cfb3aa55a85","output_domain_rule":"preserve_raw_and_clip_published_at_zero","failure_policy":"failed_fold_excludes_candidate_without_changing_common_plan","uncertainty_capability":"model_specific_calibration_pending","selectable":true,"selection_complexity_rank":3,"limitations":["Fixed regularization is not tuned; coefficients are non-causal."]},
    {"model_id":"poisson_regression","candidate_class":"learned_model","selection_role":"learned_selectable","model_family":"PoissonRegressor","estimator_library":"scikit-learn","estimator_library_version":"1.9.0","parameters":{"alpha":1.0,"fit_intercept":true,"max_iter":1000,"tol":0.0001},"parameters_sha256":"f1d10b8e22303b8d4f550861b54971e5ef2beba310a11b6458544be97871098b","preprocessing":{"type":"StandardScaler","fit_scope":"fold_training_rows_only"},"preprocessing_identity":"9a666eb944a664443f4141b148eefb109cf3894674076df8f163d0d835474645","deterministic_controls":{"runtime_hyperparameter_search":false,"browser_parameters_allowed":false,"random_seed":null},"minimum_training_rows":19,"target":"target_cases_next_2w","horizon_weeks":2,"feature_order_sha256":"aeccbe517da452e1132f08c02599418523fb003280b11ff9cda66cfb3aa55a85","output_domain_rule":"negative_or_nonfinite_output_fails_fold","failure_policy":"failed_fold_excludes_candidate_without_changing_common_plan","uncertainty_capability":"model_specific_calibration_pending","selectable":true,"selection_complexity_rank":4,"limitations":["Overdispersion means Poisson distributional fit is not claimed."]},
    {"model_id":"random_forest","candidate_class":"learned_model","selection_role":"learned_selectable","model_family":"RandomForestRegressor","estimator_library":"scikit-learn","estimator_library_version":"1.9.0","parameters":{"n_estimators":200,"max_depth":4,"min_samples_leaf":3,"max_features":1.0,"bootstrap":true,"random_state":42,"n_jobs":1,"criterion":"squared_error"},"parameters_sha256":"ac37d2d2947de2f6004d39ecdfa3290c5d65901b796f1eb1fd248ad658e1b1e0","preprocessing":{"type":"none","fit_scope":"not_applicable"},"preprocessing_identity":"47cee049c760f3f036cd525133ab0fe0f849ade9e41033cf437f470d9b843796","deterministic_controls":{"runtime_hyperparameter_search":false,"browser_parameters_allowed":false,"random_seed":42},"minimum_training_rows":19,"target":"target_cases_next_2w","horizon_weeks":2,"feature_order_sha256":"aeccbe517da452e1132f08c02599418523fb003280b11ff9cda66cfb3aa55a85","output_domain_rule":"nonnegative_training_targets_expected_fail_if_invalid","failure_policy":"failed_fold_excludes_candidate_without_changing_common_plan","uncertainty_capability":"model_specific_calibration_pending","selectable":true,"selection_complexity_rank":5,"limitations":["Small samples and correlated features can destabilize tree structure."]},
    {"model_id":"gradient_boosting","candidate_class":"learned_model","selection_role":"learned_selectable","model_family":"GradientBoostingRegressor","estimator_library":"scikit-learn","estimator_library_version":"1.9.0","parameters":{"n_estimators":200,"learning_rate":0.05,"max_depth":4,"min_samples_leaf":3,"subsample":0.8,"random_state":42,"loss":"squared_error"},"parameters_sha256":"4741d1f17b3bf98988b886dcb6157a9382b569e3264e1004d2f3eb474bd34963","preprocessing":{"type":"none","fit_scope":"not_applicable"},"preprocessing_identity":"47cee049c760f3f036cd525133ab0fe0f849ade9e41033cf437f470d9b843796","deterministic_controls":{"runtime_hyperparameter_search":false,"browser_parameters_allowed":false,"random_seed":42},"minimum_training_rows":19,"target":"target_cases_next_2w","horizon_weeks":2,"feature_order_sha256":"aeccbe517da452e1132f08c02599418523fb003280b11ff9cda66cfb3aa55a85","output_domain_rule":"preserve_raw_and_clip_published_at_zero","failure_policy":"failed_fold_excludes_candidate_without_changing_common_plan","uncertainty_capability":"model_specific_calibration_pending","selectable":true,"selection_complexity_rank":6,"limitations":["Fixed boosting configuration is not tuned."]},
    {"model_id":"elastic_net","candidate_class":"learned_model","selection_role":"learned_selectable","model_family":"ElasticNet","estimator_library":"scikit-learn","estimator_library_version":"1.9.0","parameters":{"alpha":0.1,"l1_ratio":0.5,"fit_intercept":true,"precompute":false,"max_iter":10000,"copy_X":true,"tol":0.0001,"warm_start":false,"positive":false,"selection":"cyclic"},"parameters_sha256":"780e70db5088d04dfb4ac303fe4ef63db07ce115060e3c70129ec9df28f36542","preprocessing":{"type":"StandardScaler","fit_scope":"fold_training_rows_only"},"preprocessing_identity":"9a666eb944a664443f4141b148eefb109cf3894674076df8f163d0d835474645","deterministic_controls":{"runtime_hyperparameter_search":false,"browser_parameters_allowed":false,"random_seed":null},"minimum_training_rows":19,"target":"target_cases_next_2w","horizon_weeks":2,"feature_order_sha256":"aeccbe517da452e1132f08c02599418523fb003280b11ff9cda66cfb3aa55a85","output_domain_rule":"preserve_raw_and_clip_published_at_zero","failure_policy":"failed_fold_excludes_candidate_without_changing_common_plan","uncertainty_capability":"model_specific_calibration_pending","selectable":true,"selection_complexity_rank":7,"limitations":["Frozen regularization is not a hyperparameter search."]},